"","word","freq","prob"
"i am and what im capable","i am and what im capable",2,0.000327171601504989
"i am going to be a","i am going to be a",2,0.000327171601504989
"i am interested in followfollow do","i am interested in followfollow do",2,0.000327171601504989
"i am looking forward to the","i am looking forward to the",2,0.000327171601504989
"i am not a fan of","i am not a fan of",2,0.000327171601504989
"i am proud to be a","i am proud to be a",2,0.000327171601504989
"i am very lucky to have","i am very lucky to have",2,0.000327171601504989
"i asked if he had a","i asked if he had a",2,0.000327171601504989
"i beseech you therefore brethren by","i beseech you therefore brethren by",2,0.000327171601504989
"i can get a picture of","i can get a picture of",2,0.000327171601504989
"i can get an eskimo for","i can get an eskimo for",2,0.000327171601504989
"i can take care of my","i can take care of my",2,0.000327171601504989
"i cant believe im going to","i cant believe im going to",2,0.000327171601504989
"i cant even tell you how","i cant even tell you how",2,0.000327171601504989
"i cant help but feel like","i cant help but feel like",2,0.000327171601504989
"i cant help but wonder what","i cant help but wonder what",2,0.000327171601504989
"i cant keep up with the","i cant keep up with the",2,0.000327171601504989
"i cant make it to the","i cant make it to the",2,0.000327171601504989
"i cant tell you how many","i cant tell you how many",2,0.000327171601504989
"i cant think of a better","i cant think of a better",2,0.000327171601504989
"i cant wait to see that","i cant wait to see that",2,0.000327171601504989
"i cant wait to try out","i cant wait to try out",2,0.000327171601504989
"i couldnt ask for a better","i couldnt ask for a better",2,0.000327171601504989
"i currently have a contract with","i currently have a contract with",2,0.000327171601504989
"i did not want to be","i did not want to be",2,0.000327171601504989
"i did the best i could","i did the best i could",2,0.000327171601504989
"i didnt have a job i","i didnt have a job i",2,0.000327171601504989
"i didnt have a lot of","i didnt have a lot of",2,0.000327171601504989
"i didnt have the time to","i didnt have the time to",2,0.000327171601504989
"i didnt make pitches when i","i didnt make pitches when i",2,0.000327171601504989
"i didnt think i was going","i didnt think i was going",2,0.000327171601504989
"i didnt want to make this","i didnt want to make this",2,0.000327171601504989
"i do not care for the","i do not care for the",2,0.000327171601504989
"i do not know what the","i do not know what the",2,0.000327171601504989
"i do solemnly swear that i","i do solemnly swear that i",2,0.000327171601504989
"i dont care what anyone says","i dont care what anyone says",2,0.000327171601504989
"i dont have a lot of","i dont have a lot of",2,0.000327171601504989
"i dont know if i can","i dont know if i can",2,0.000327171601504989
"i dont know what im going","i dont know what im going",2,0.000327171601504989
"i dont know what youre talking","i dont know what youre talking",2,0.000327171601504989
"i dont remember the last time","i dont remember the last time",2,0.000327171601504989
"i dont think i will ever","i dont think i will ever",2,0.000327171601504989
"i dont think it gets any","i dont think it gets any",2,0.000327171601504989
"i dont think that would be","i dont think that would be",2,0.000327171601504989
"i dont think there is a","i dont think there is a",2,0.000327171601504989
"i dont want that i want","i dont want that i want",2,0.000327171601504989
"i dont want to get too","i dont want to get too",2,0.000327171601504989
"i dont want to have to","i dont want to have to",2,0.000327171601504989
"i dont want to talk about","i dont want to talk about",2,0.000327171601504989
"i doubt youll see this but","i doubt youll see this but",2,0.000327171601504989
"i fall asleep every nightwake up","i fall asleep every nightwake up",2,0.000327171601504989
"i feel like a lot of","i feel like a lot of",2,0.000327171601504989
"i feel like im going to","i feel like im going to",2,0.000327171601504989
"i felt like i was in","i felt like i was in",2,0.000327171601504989
"i find it hard to believe","i find it hard to believe",2,0.000327171601504989
"i forgot to mention that the","i forgot to mention that the",2,0.000327171601504989
"i get a happy birthday kimberly","i get a happy birthday kimberly",2,0.000327171601504989
"i guess i will have to","i guess i will have to",2,0.000327171601504989
"i had a bit of a","i had a bit of a",2,0.000327171601504989
"i had a flashback to the","i had a flashback to the",2,0.000327171601504989
"i had a lot of fun","i had a lot of fun",2,0.000327171601504989
"i had no idea how to","i had no idea how to",2,0.000327171601504989
"i had no idea what i","i had no idea what i",2,0.000327171601504989
"i had to get out of","i had to get out of",2,0.000327171601504989
"i hate to say it because","i hate to say it because",2,0.000327171601504989
"i have a lovehate relationship with","i have a lovehate relationship with",2,0.000327171601504989
"i have a soft spot for","i have a soft spot for",2,0.000327171601504989
"i have an excuse to buy","i have an excuse to buy",2,0.000327171601504989
"i have been lucky enough to","i have been lucky enough to",2,0.000327171601504989
"i have had in a long","i have had in a long",2,0.000327171601504989
"i have no idea what im","i have no idea what im",2,0.000327171601504989
"i have nothing better to do","i have nothing better to do",2,0.000327171601504989
"i have nothing to live for","i have nothing to live for",2,0.000327171601504989
"i have to force myself to","i have to force myself to",2,0.000327171601504989
"i have to get back to","i have to get back to",2,0.000327171601504989
"i have to get used to","i have to get used to",2,0.000327171601504989
"i have to say that i","i have to say that i",2,0.000327171601504989
"i havent been this excited about","i havent been this excited about",2,0.000327171601504989
"i havent had a chance to","i havent had a chance to",2,0.000327171601504989
"i highly recommend it if you","i highly recommend it if you",2,0.000327171601504989
"i hope that all of you","i hope that all of you",2,0.000327171601504989
"i hope to meet you someday","i hope to meet you someday",2,0.000327171601504989
"i hope to see some of","i hope to see some of",2,0.000327171601504989
"i hope you all are enjoying","i hope you all are enjoying",2,0.000327171601504989
"i hope you all had a","i hope you all had a",2,0.000327171601504989
"i just cant get enough of","i just cant get enough of",2,0.000327171601504989
"i just cant wait until new","i just cant wait until new",2,0.000327171601504989
"i just didnt know what to","i just didnt know what to",2,0.000327171601504989
"i just got invited to a","i just got invited to a",2,0.000327171601504989
"i just like the idea that","i just like the idea that",2,0.000327171601504989
"i knew i was going to","i knew i was going to",2,0.000327171601504989
"i know for a fact that","i know for a fact that",2,0.000327171601504989
"i know that is part of","i know that is part of",2,0.000327171601504989
"i know this is going to","i know this is going to",2,0.000327171601504989
"i know you know that i","i know you know that i",2,0.000327171601504989
"i look forward to getting to","i look forward to getting to",2,0.000327171601504989
"i look forward to reading more","i look forward to reading more",2,0.000327171601504989
"i love the fact that my","i love the fact that my",2,0.000327171601504989
"i love the fact that the","i love the fact that the",2,0.000327171601504989
"i love you can i get","i love you can i get",2,0.000327171601504989
"i love you not only for","i love you not only for",2,0.000327171601504989
"i love you so much and","i love you so much and",2,0.000327171601504989
"i love you so much you","i love you so much you",2,0.000327171601504989
"i may or may not have","i may or may not have",2,0.000327171601504989
"i might be able to make","i might be able to make",2,0.000327171601504989
"i need to go to the","i need to go to the",2,0.000327171601504989
"i need to lose some weight","i need to lose some weight",2,0.000327171601504989
"i need you in my life","i need you in my life",2,0.000327171601504989
"i never thought id see the","i never thought id see the",2,0.000327171601504989
"i no longer live in a","i no longer live in a",2,0.000327171601504989
"i once heard given to a","i once heard given to a",2,0.000327171601504989
"i really want to do this","i really want to do this",2,0.000327171601504989
"i recently got the chance to","i recently got the chance to",2,0.000327171601504989
"i remember the first time i","i remember the first time i",2,0.000327171601504989
"i see what you did there","i see what you did there",2,0.000327171601504989
"i should have been more specific","i should have been more specific",2,0.000327171601504989
"i spent a lot of time","i spent a lot of time",2,0.000327171601504989
"i spent most of the day","i spent most of the day",2,0.000327171601504989
"i still love to this day","i still love to this day",2,0.000327171601504989
"i think a lot of that","i think a lot of that",2,0.000327171601504989
"i think i might have just","i think i might have just",2,0.000327171601504989
"i think i need to stop","i think i need to stop",2,0.000327171601504989
"i think im going to need","i think im going to need",2,0.000327171601504989
"i think it has to be","i think it has to be",2,0.000327171601504989
"i think it turned out great","i think it turned out great",2,0.000327171601504989
"i think it will be a","i think it will be a",2,0.000327171601504989
"i think that this is a","i think that this is a",2,0.000327171601504989
"i think the whole thing is","i think the whole thing is",2,0.000327171601504989
"i thought i was going to","i thought i was going to",2,0.000327171601504989
"i thought i was gonna die","i thought i was gonna die",2,0.000327171601504989
"i thought that it would be","i thought that it would be",2,0.000327171601504989
"i usually have to wake up","i usually have to wake up",2,0.000327171601504989
"i want to be able to","i want to be able to",2,0.000327171601504989
"i want to take this opportunity","i want to take this opportunity",2,0.000327171601504989
"i wanted to make something for","i wanted to make something for",2,0.000327171601504989
"i was going to have a","i was going to have a",2,0.000327171601504989
"i was in a hurry and","i was in a hurry and",2,0.000327171601504989
"i was on my way to","i was on my way to",2,0.000327171601504989
"i was one of the few","i was one of the few",2,0.000327171601504989
"i was so proud of him","i was so proud of him",2,0.000327171601504989
"i will buy it and listen","i will buy it and listen",2,0.000327171601504989
"i will have to check it","i will have to check it",2,0.000327171601504989
"i will see if i can","i will see if i can",2,0.000327171601504989
"i will support and defend the","i will support and defend the",2,0.000327171601504989
"i will try to make it","i will try to make it",2,0.000327171601504989
"i wish i could be there","i wish i could be there",2,0.000327171601504989
"i wish i could talk to","i wish i could talk to",2,0.000327171601504989
"i would like to thank the","i would like to thank the",2,0.000327171601504989
"i would love to but i","i would love to but i",2,0.000327171601504989
"i would love to hear what","i would love to hear what",2,0.000327171601504989
"i would personally like to thank","i would personally like to thank",2,0.000327171601504989
"ice i can get an eskimo","ice i can get an eskimo",2,0.000327171601504989
"id be lying if i said","id be lying if i said",2,0.000327171601504989
"if i were you i would","if i were you i would",2,0.000327171601504989
"if i would be interested in","if i would be interested in",2,0.000327171601504989
"if its brown flush it down","if its brown flush it down",2,0.000327171601504989
"if its yellow let it mellow","if its yellow let it mellow",2,0.000327171601504989
"if they are willing to pay","if they are willing to pay",2,0.000327171601504989
"if they love you they will","if they love you they will",2,0.000327171601504989
"if u get a chance u","if u get a chance u",2,0.000327171601504989
"if you are a fan of","if you are a fan of",2,0.000327171601504989
"if you are going to the","if you are going to the",2,0.000327171601504989
"if you can dream it you","if you can dream it you",2,0.000327171601504989
"if you dont want to be","if you dont want to be",2,0.000327171601504989
"if you dont want to you","if you dont want to you",2,0.000327171601504989
"if you fail but you are","if you fail but you are",2,0.000327171601504989
"if you follow me on twitter","if you follow me on twitter",2,0.000327171601504989
"if you invest million you will","if you invest million you will",2,0.000327171601504989
"if you lie very still in","if you lie very still in",2,0.000327171601504989
"if you lost all your money","if you lost all your money",2,0.000327171601504989
"if you need more follows try","if you need more follows try",2,0.000327171601504989
"if you want to create a","if you want to create a",2,0.000327171601504989
"if you want to see what","if you want to see what",2,0.000327171601504989
"if you would like to get","if you would like to get",2,0.000327171601504989
"if your actions inspire others to","if your actions inspire others to",2,0.000327171601504989
"if youre a fan of the","if youre a fan of the",2,0.000327171601504989
"ill definitely be doing it again","ill definitely be doing it again",2,0.000327171601504989
"ill have to do that then","ill have to do that then",2,0.000327171601504989
"ill pin the shit out of","ill pin the shit out of",2,0.000327171601504989
"illinois incorporated in item b above","illinois incorporated in item b above",2,0.000327171601504989
"illinois incorporated in item c above","illinois incorporated in item c above",2,0.000327171601504989
"illustrating his own work he also","illustrating his own work he also",2,0.000327171601504989
"im a huge fan of the","im a huge fan of the",2,0.000327171601504989
"im going to do with my","im going to do with my",2,0.000327171601504989
"im not going to get into","im not going to get into",2,0.000327171601504989
"im not sure i would have","im not sure i would have",2,0.000327171601504989
"im not the only one that","im not the only one that",2,0.000327171601504989
"im one of those people who","im one of those people who",2,0.000327171601504989
"im so hungry i could eat","im so hungry i could eat",2,0.000327171601504989
"in a food processor combine the","in a food processor combine the",2,0.000327171601504989
"in a hooded sweatshirt under all","in a hooded sweatshirt under all",2,0.000327171601504989
"in a small bowl stir together","in a small bowl stir together",2,0.000327171601504989
"in a small saucepan over medium","in a small saucepan over medium",2,0.000327171601504989
"in a very short amount of","in a very short amount of",2,0.000327171601504989
"in afghanistan while delivering justice to","in afghanistan while delivering justice to",2,0.000327171601504989
"in an attempt to get out","in an attempt to get out",2,0.000327171601504989
"in at the height of the","in at the height of the",2,0.000327171601504989
"in atlanta ga it is degrees","in atlanta ga it is degrees",2,0.000327171601504989
"in bed in a hooded sweatshirt","in bed in a hooded sweatshirt",2,0.000327171601504989
"in case you were wondering the","in case you were wondering the",2,0.000327171601504989
"in custody in the county jail","in custody in the county jail",2,0.000327171601504989
"in europe where gm lost million","in europe where gm lost million",2,0.000327171601504989
"in followfollow do you or no","in followfollow do you or no",2,0.000327171601504989
"in for free txt me i","in for free txt me i",2,0.000327171601504989
"in half and more will be","in half and more will be",2,0.000327171601504989
"in harms way has been cut","in harms way has been cut",2,0.000327171601504989
"in less than a month in","in less than a month in",2,0.000327171601504989
"in line at the grocery store","in line at the grocery store",2,0.000327171601504989
"in los angeles new york and","in los angeles new york and",2,0.000327171601504989
"in my lap while i read","in my lap while i read",2,0.000327171601504989
"in my life is making my","in my life is making my",2,0.000327171601504989
"in no small part because of","in no small part because of",2,0.000327171601504989
"in order to make the best","in order to make the best",2,0.000327171601504989
"in prison without the possibility of","in prison without the possibility of",2,0.000327171601504989
"in recent months he had said","in recent months he had said",2,0.000327171601504989
"in remarks that rejected beijings criticism","in remarks that rejected beijings criticism",2,0.000327171601504989
"in the air baby heavens in","in the air baby heavens in",2,0.000327171601504989
"in the army for years and","in the army for years and",2,0.000327171601504989
"in the bottom of the baking","in the bottom of the baking",2,0.000327171601504989
"in the bottom of the ninth","in the bottom of the ninth",2,0.000327171601504989
"in the bottom of the sixth","in the bottom of the sixth",2,0.000327171601504989
"in the bowl of an electric","in the bowl of an electric",2,0.000327171601504989
"in the first half of the","in the first half of the",2,0.000327171601504989
"in the first place and how","in the first place and how",2,0.000327171601504989
"in the first round of the","in the first round of the",2,0.000327171601504989
"in the first two games of","in the first two games of",2,0.000327171601504989
"in the future but for now","in the future but for now",2,0.000327171601504989
"in the grand scheme of things","in the grand scheme of things",2,0.000327171601504989
"in the history of the world","in the history of the world",2,0.000327171601504989
"in the late s and early","in the late s and early",2,0.000327171601504989
"in the middle of the jungle","in the middle of the jungle",2,0.000327171601504989
"in the middle of the room","in the middle of the room",2,0.000327171601504989
"in the middle of the season","in the middle of the season",2,0.000327171601504989
"in the news again this time","in the news again this time",2,0.000327171601504989
"in the next couple of days","in the next couple of days",2,0.000327171601504989
"in the next couple of months","in the next couple of months",2,0.000327171601504989
"in the next couple of weeks","in the next couple of weeks",2,0.000327171601504989
"in the parking lot of the","in the parking lot of the",2,0.000327171601504989
"in the second half of the","in the second half of the",2,0.000327171601504989
"in the southern part of the","in the southern part of the",2,0.000327171601504989
"inspire others to dream more learn","inspire others to dream more learn",2,0.000327171601504989
"instead interrogated him and questioned him","instead interrogated him and questioned him",2,0.000327171601504989
"interested in followfollow do you or","interested in followfollow do you or",2,0.000327171601504989
"international but as he prepared to","international but as he prepared to",2,0.000327171601504989
"interrogated him and questioned him about","interrogated him and questioned him about",2,0.000327171601504989
"into the threads of the sheets","into the threads of the sheets",2,0.000327171601504989
"intro is not cute its more","intro is not cute its more",2,0.000327171601504989
"invest million you will have an","invest million you will have an",2,0.000327171601504989
"iraq war is over the number","iraq war is over the number",2,0.000327171601504989
"is a great way to get","is a great way to get",2,0.000327171601504989
"is a group of people who","is a group of people who",2,0.000327171601504989
"is a man who always remembers","is a man who always remembers",2,0.000327171601504989
"is a member of the board","is a member of the board",2,0.000327171601504989
"is a thing of the past","is a thing of the past",2,0.000327171601504989
"is an important part of a","is an important part of a",2,0.000327171601504989
"is at the center of a","is at the center of a",2,0.000327171601504989
"is at the heart of the","is at the heart of the",2,0.000327171601504989
"is better than the mighty and","is better than the mighty and",2,0.000327171601504989
"is crazy but heres my number","is crazy but heres my number",2,0.000327171601504989
"is exciting for both singles a","is exciting for both singles a",2,0.000327171601504989
"is expected to be completed by","is expected to be completed by",2,0.000327171601504989
"is for adults and for children","is for adults and for children",2,0.000327171601504989
"is for me who can be","is for me who can be",2,0.000327171601504989
"is free and open to the","is free and open to the",2,0.000327171601504989
"is going to be a fun","is going to be a fun",2,0.000327171601504989
"is going to be a great","is going to be a great",2,0.000327171601504989
"is going to be an ongoing","is going to be an ongoing",2,0.000327171601504989
"is going to be really hard","is going to be really hard",2,0.000327171601504989
"is good and his love endures","is good and his love endures",2,0.000327171601504989
"is good and ready to go","is good and ready to go",2,0.000327171601504989
"is having a bit of a","is having a bit of a",2,0.000327171601504989
"is how much youd be worth","is how much youd be worth",2,0.000327171601504989
"is in the best interest of","is in the best interest of",2,0.000327171601504989
"is in the midst of an","is in the midst of an",2,0.000327171601504989
"is just as important as what","is just as important as what",2,0.000327171601504989
"is making my way here to","is making my way here to",2,0.000327171601504989
"is not cute its more like","is not cute its more like",2,0.000327171601504989
"is not the same thing as","is not the same thing as",2,0.000327171601504989
"is one of my least favorite","is one of my least favorite",2,0.000327171601504989
"is one of the most important","is one of the most important",2,0.000327171601504989
"is one of the most popular","is one of the most popular",2,0.000327171601504989
"is one of the most wellknown","is one of the most wellknown",2,0.000327171601504989
"is one of the reasons i","is one of the reasons i",2,0.000327171601504989
"is one of the things i","is one of the things i",2,0.000327171601504989
"is one who can lay a","is one who can lay a",2,0.000327171601504989
"is open daily from am to","is open daily from am to",2,0.000327171601504989
"is over the number of our","is over the number of our",2,0.000327171601504989
"is probably one of my favorite","is probably one of my favorite",2,0.000327171601504989
"is slow to anger is better","is slow to anger is better",2,0.000327171601504989
"is still a long way from","is still a long way from",2,0.000327171601504989
"is still a member of the","is still a member of the",2,0.000327171601504989
"is that good and acceptable and","is that good and acceptable and",2,0.000327171601504989
"is that they always see the","is that they always see the",2,0.000327171601504989
"is the author of the lulu","is the author of the lulu",2,0.000327171601504989
"is the executive director of the","is the executive director of the",2,0.000327171601504989
"is the first time ive seen","is the first time ive seen",2,0.000327171601504989
"is the latest in a series","is the latest in a series",2,0.000327171601504989
"is the only thing that ever","is the only thing that ever",2,0.000327171601504989
"is the responsibility of adults to","is the responsibility of adults to",2,0.000327171601504989
"is the samsung galaxy note a","is the samsung galaxy note a",2,0.000327171601504989
"is trying to tell me something","is trying to tell me something",2,0.000327171601504989
"is very fortunate to have a","is very fortunate to have a",2,0.000327171601504989
"is your favorite thing to do","is your favorite thing to do",2,0.000327171601504989
"it and at the same time","it and at the same time",2,0.000327171601504989
"it and listen to it everyday","it and listen to it everyday",2,0.000327171601504989
"it didnt take long for me","it didnt take long for me",2,0.000327171601504989
"it everyday im so proud of","it everyday im so proud of",2,0.000327171601504989
"it goes without saying that i","it goes without saying that i",2,0.000327171601504989
"it got to the point where","it got to the point where",2,0.000327171601504989
"it has been a lot of","it has been a lot of",2,0.000327171601504989
"it has been a while since","it has been a while since",2,0.000327171601504989
"it has been years since i","it has been years since i",2,0.000327171601504989
"it is important to note that","it is important to note that",2,0.000327171601504989
"it is important to read the","it is important to read the",2,0.000327171601504989
"it is the responsibility of adults","it is the responsibility of adults",2,0.000327171601504989
"it is what it is i","it is what it is i",2,0.000327171601504989
"it keep up the good work","it keep up the good work",2,0.000327171601504989
"it means the world to me","it means the world to me",2,0.000327171601504989
"it mellow if its brown flush","it mellow if its brown flush",2,0.000327171601504989
"it seems right now that all","it seems right now that all",2,0.000327171601504989
"it seems to me that the","it seems to me that the",2,0.000327171601504989
"it should be noted that it","it should be noted that it",2,0.000327171601504989
"it snow let it snow let","it snow let it snow let",2,0.000327171601504989
"it so hard to be happy","it so hard to be happy",2,0.000327171601504989
"it takes a long time to","it takes a long time to",2,0.000327171601504989
"it was a beautiful spring day","it was a beautiful spring day",2,0.000327171601504989
"it was a high counsel that","it was a high counsel that",2,0.000327171601504989
