"","word","freq","prob"
"at the end of the day","at the end of the day",24,0.00392605921805987
"happy mothers day to all the","happy mothers day to all the",10,0.00163585800752495
"on the other side of the","on the other side of the",10,0.00163585800752495
"cake cake cake cake cake cake","cake cake cake cake cake cake",8,0.00130868640601996
"i dont know about you but","i dont know about you but",8,0.00130868640601996
"in the middle of the night","in the middle of the night",8,0.00130868640601996
"all you have to do is","all you have to do is",7,0.00114510060526746
"its only a matter of time","its only a matter of time",7,0.00114510060526746
"let me know what you think","let me know what you think",7,0.00114510060526746
"on the side of the road","on the side of the road",7,0.00114510060526746
"only a matter of time before","only a matter of time before",7,0.00114510060526746
"a means for sites to earn","a means for sites to earn",6,0.000981514804514968
"a participant in the amazon services","a participant in the amazon services",6,0.000981514804514968
"advertising and linking to amazoncom amazonca","advertising and linking to amazoncom amazonca",6,0.000981514804514968
"advertising fees by advertising and linking","advertising fees by advertising and linking",6,0.000981514804514968
"all i want to do is","all i want to do is",6,0.000981514804514968
"amazon eu associates programmes designed to","amazon eu associates programmes designed to",6,0.000981514804514968
"amazon eu this content is provided","amazon eu this content is provided",6,0.000981514804514968
"amazon services llc and amazon eu","amazon services llc and amazon eu",6,0.000981514804514968
"amazon services llc andor amazon eu","amazon services llc andor amazon eu",6,0.000981514804514968
"amazonca amazoncouk amazonde amazonfr amazonit and","amazonca amazoncouk amazonde amazonfr amazonit and",6,0.000981514804514968
"amazoncom amazonca amazoncouk amazonde amazonfr amazonit","amazoncom amazonca amazoncouk amazonde amazonfr amazonit",6,0.000981514804514968
"amazoncouk amazonde amazonfr amazonit and amazones","amazoncouk amazonde amazonfr amazonit and amazones",6,0.000981514804514968
"amazonde amazonfr amazonit and amazones certain","amazonde amazonfr amazonit and amazones certain",6,0.000981514804514968
"amazones certain content that appears on","amazones certain content that appears on",6,0.000981514804514968
"amazonfr amazonit and amazones certain content","amazonfr amazonit and amazones certain content",6,0.000981514804514968
"amazonit and amazones certain content that","amazonit and amazones certain content that",6,0.000981514804514968
"and amazon eu associates programmes designed","and amazon eu associates programmes designed",6,0.000981514804514968
"and amazones certain content that appears","and amazones certain content that appears",6,0.000981514804514968
"and is subject to change or","and is subject to change or",6,0.000981514804514968
"and linking to amazoncom amazonca amazoncouk","and linking to amazoncom amazonca amazoncouk",6,0.000981514804514968
"andor amazon eu this content is","andor amazon eu this content is",6,0.000981514804514968
"appears on this website comes from","appears on this website comes from",6,0.000981514804514968
"as is and is subject to","as is and is subject to",6,0.000981514804514968
"associates programmes designed to provide a","associates programmes designed to provide a",6,0.000981514804514968
"at the end of the season","at the end of the season",6,0.000981514804514968
"by advertising and linking to amazoncom","by advertising and linking to amazoncom",6,0.000981514804514968
"by the end of the day","by the end of the day",6,0.000981514804514968
"calories g protein g carbohydrate g","calories g protein g carbohydrate g",6,0.000981514804514968
"carbohydrate g fat g saturated mg","carbohydrate g fat g saturated mg",6,0.000981514804514968
"certain content that appears on this","certain content that appears on this",6,0.000981514804514968
"change or removal at any time","change or removal at any time",6,0.000981514804514968
"comes from amazon services llc andor","comes from amazon services llc andor",6,0.000981514804514968
"content is provided as is and","content is provided as is and",6,0.000981514804514968
"content that appears on this website","content that appears on this website",6,0.000981514804514968
"designed to provide a means for","designed to provide a means for",6,0.000981514804514968
"earn advertising fees by advertising and","earn advertising fees by advertising and",6,0.000981514804514968
"eu associates programmes designed to provide","eu associates programmes designed to provide",6,0.000981514804514968
"eu this content is provided as","eu this content is provided as",6,0.000981514804514968
"fat g saturated mg cholesterol mg","fat g saturated mg cholesterol mg",6,0.000981514804514968
"fees by advertising and linking to","fees by advertising and linking to",6,0.000981514804514968
"for sites to earn advertising fees","for sites to earn advertising fees",6,0.000981514804514968
"from amazon services llc andor amazon","from amazon services llc andor amazon",6,0.000981514804514968
"g carbohydrate g fat g saturated","g carbohydrate g fat g saturated",6,0.000981514804514968
"g fat g saturated mg cholesterol","g fat g saturated mg cholesterol",6,0.000981514804514968
"g protein g carbohydrate g fat","g protein g carbohydrate g fat",6,0.000981514804514968
"g saturated mg cholesterol mg sodium","g saturated mg cholesterol mg sodium",6,0.000981514804514968
"in the amazon services llc and","in the amazon services llc and",6,0.000981514804514968
"incorporated in item c above pp","incorporated in item c above pp",6,0.000981514804514968
"is a participant in the amazon","is a participant in the amazon",6,0.000981514804514968
"is and is subject to change","is and is subject to change",6,0.000981514804514968
"is provided as is and is","is provided as is and is",6,0.000981514804514968
"is subject to change or removal","is subject to change or removal",6,0.000981514804514968
"linking to amazoncom amazonca amazoncouk amazonde","linking to amazoncom amazonca amazoncouk amazonde",6,0.000981514804514968
"llc and amazon eu associates programmes","llc and amazon eu associates programmes",6,0.000981514804514968
"llc andor amazon eu this content","llc andor amazon eu this content",6,0.000981514804514968
"means for sites to earn advertising","means for sites to earn advertising",6,0.000981514804514968
"on this website comes from amazon","on this website comes from amazon",6,0.000981514804514968
"participant in the amazon services llc","participant in the amazon services llc",6,0.000981514804514968
"programmes designed to provide a means","programmes designed to provide a means",6,0.000981514804514968
"protein g carbohydrate g fat g","protein g carbohydrate g fat g",6,0.000981514804514968
"provide a means for sites to","provide a means for sites to",6,0.000981514804514968
"provided as is and is subject","provided as is and is subject",6,0.000981514804514968
"services llc and amazon eu associates","services llc and amazon eu associates",6,0.000981514804514968
"services llc andor amazon eu this","services llc andor amazon eu this",6,0.000981514804514968
"sites to earn advertising fees by","sites to earn advertising fees by",6,0.000981514804514968
"subject to change or removal at","subject to change or removal at",6,0.000981514804514968
"thank you so much for the","thank you so much for the",6,0.000981514804514968
"that appears on this website comes","that appears on this website comes",6,0.000981514804514968
"the amazon services llc and amazon","the amazon services llc and amazon",6,0.000981514804514968
"there is no such thing as","there is no such thing as",6,0.000981514804514968
"this content is provided as is","this content is provided as is",6,0.000981514804514968
"this is going to be a","this is going to be a",6,0.000981514804514968
"this website comes from amazon services","this website comes from amazon services",6,0.000981514804514968
"to amazoncom amazonca amazoncouk amazonde amazonfr","to amazoncom amazonca amazoncouk amazonde amazonfr",6,0.000981514804514968
"to change or removal at any","to change or removal at any",6,0.000981514804514968
"to earn advertising fees by advertising","to earn advertising fees by advertising",6,0.000981514804514968
"to provide a means for sites","to provide a means for sites",6,0.000981514804514968
"website comes from amazon services llc","website comes from amazon services llc",6,0.000981514804514968
"all i had to do was","all i had to do was",5,0.000817929003762473
"at the end of the year","at the end of the year",5,0.000817929003762473
"but at the end of the","but at the end of the",5,0.000817929003762473
"cant wait to see what you","cant wait to see what you",5,0.000817929003762473
"department of health and human services","department of health and human services",5,0.000817929003762473
"dont know about you but i","dont know about you but i",5,0.000817929003762473
"foot in front of the other","foot in front of the other",5,0.000817929003762473
"for a chance to win a","for a chance to win a",5,0.000817929003762473
"for the first time in a","for the first time in a",5,0.000817929003762473
"for the rest of the day","for the rest of the day",5,0.000817929003762473
"for the rest of the year","for the rest of the year",5,0.000817929003762473
"if i do say so myself","if i do say so myself",5,0.000817929003762473
"let us know if you need","let us know if you need",5,0.000817929003762473
"met you and this is crazy","met you and this is crazy",5,0.000817929003762473
"on the new york stock exchange","on the new york stock exchange",5,0.000817929003762473
"one foot in front of the","one foot in front of the",5,0.000817929003762473
"the end of the school year","the end of the school year",5,0.000817929003762473
"the latest in a series of","the latest in a series of",5,0.000817929003762473
"the rock and roll hall of","the rock and roll hall of",5,0.000817929003762473
"trying to figure out how to","trying to figure out how to",5,0.000817929003762473
"you and this is crazy but","you and this is crazy but",5,0.000817929003762473
"all you need to do is","all you need to do is",4,0.000654343203009979
"and sashacan they sing happy birthday","and sashacan they sing happy birthday",4,0.000654343203009979
"as far as i can tell","as far as i can tell",4,0.000654343203009979
"at the end of the game","at the end of the game",4,0.000654343203009979
"at the end of the night","at the end of the night",4,0.000654343203009979
"at the start of the season","at the start of the season",4,0.000654343203009979
"birthday to her please what kind","birthday to her please what kind",4,0.000654343203009979
"cant wait to see you in","cant wait to see you in",4,0.000654343203009979
"centers for disease control and prevention","centers for disease control and prevention",4,0.000654343203009979
"donuts do the boyz like dd","donuts do the boyz like dd",4,0.000654343203009979
"for the rest of their lives","for the rest of their lives",4,0.000654343203009979
"happy birthday to her please what","happy birthday to her please what",4,0.000654343203009979
"harry potter and the deathly hallows","harry potter and the deathly hallows",4,0.000654343203009979
"have to figure out how to","have to figure out how to",4,0.000654343203009979
"have to go to the dentist","have to go to the dentist",4,0.000654343203009979
"her please what kind of donuts","her please what kind of donuts",4,0.000654343203009979
"hey i just met you and","hey i just met you and",4,0.000654343203009979
"hope to see you again soon","hope to see you again soon",4,0.000654343203009979
"hope you had a great time","hope you had a great time",4,0.000654343203009979
"hope you had a great weekend","hope you had a great weekend",4,0.000654343203009979
"i cant remember the last time","i cant remember the last time",4,0.000654343203009979
"i cant wait to see what","i cant wait to see what",4,0.000654343203009979
"i do that all the time","i do that all the time",4,0.000654343203009979
"i dont even know what to","i dont even know what to",4,0.000654343203009979
"i just finished a mi run","i just finished a mi run",4,0.000654343203009979
"i just met you and this","i just met you and this",4,0.000654343203009979
"i really dont know what to","i really dont know what to",4,0.000654343203009979
"i would like to write about","i would like to write about",4,0.000654343203009979
"it will be interesting to see","it will be interesting to see",4,0.000654343203009979
"its going to be a great","its going to be a great",4,0.000654343203009979
"just finished a mi run with","just finished a mi run with",4,0.000654343203009979
"just met you and this is","just met you and this is",4,0.000654343203009979
"kimberly and sashacan they sing happy","kimberly and sashacan they sing happy",4,0.000654343203009979
"kind of donuts do the boyz","kind of donuts do the boyz",4,0.000654343203009979
"let it snow let it snow","let it snow let it snow",4,0.000654343203009979
"let us know what you think","let us know what you think",4,0.000654343203009979
"mg cholesterol mg sodium g fiber","mg cholesterol mg sodium g fiber",4,0.000654343203009979
"not going to be able to","not going to be able to",4,0.000654343203009979
"now that i think about it","now that i think about it",4,0.000654343203009979
"of donuts do the boyz like","of donuts do the boyz like",4,0.000654343203009979
"please what kind of donuts do","please what kind of donuts do",4,0.000654343203009979
"rock and roll hall of fame","rock and roll hall of fame",4,0.000654343203009979
"sashacan they sing happy birthday to","sashacan they sing happy birthday to",4,0.000654343203009979
"saturated mg cholesterol mg sodium g","saturated mg cholesterol mg sodium g",4,0.000654343203009979
"serving calories g protein g carbohydrate","serving calories g protein g carbohydrate",4,0.000654343203009979
"shoutout to kimberly and sashacan they","shoutout to kimberly and sashacan they",4,0.000654343203009979
"sing happy birthday to her please","sing happy birthday to her please",4,0.000654343203009979
"thank you for all you do","thank you for all you do",4,0.000654343203009979
"thank you so much for your","thank you so much for your",4,0.000654343203009979
"the end of the day the","the end of the day the",4,0.000654343203009979
"the first five games of the","the first five games of the",4,0.000654343203009979
"the first thing i did was","the first thing i did was",4,0.000654343203009979
"the girl with the dragon tattoo","the girl with the dragon tattoo",4,0.000654343203009979
"the us fish and wildlife service","the us fish and wildlife service",4,0.000654343203009979
"they sing happy birthday to her","they sing happy birthday to her",4,0.000654343203009979
"to be a part of the","to be a part of the",4,0.000654343203009979
"to her please what kind of","to her please what kind of",4,0.000654343203009979
"to kimberly and sashacan they sing","to kimberly and sashacan they sing",4,0.000654343203009979
"what kind of donuts do the","what kind of donuts do the",4,0.000654343203009979
"what the hell is going on","what the hell is going on",4,0.000654343203009979
"when i was in th grade","when i was in th grade",4,0.000654343203009979
"would be a good time to","would be a good time to",4,0.000654343203009979
"you want to see in the","you want to see in the",4,0.000654343203009979
"a big welcome to my new","a big welcome to my new",3,0.000490757402257484
"a force to be reckoned with","a force to be reckoned with",3,0.000490757402257484
"a great day to be a","a great day to be a",3,0.000490757402257484
"a home in the block of","a home in the block of",3,0.000490757402257484
"a little over a year ago","a little over a year ago",3,0.000490757402257484
"a lot of time in the","a lot of time in the",3,0.000490757402257484
"a small group of thoughtful committed","a small group of thoughtful committed",3,0.000490757402257484
"a step in the right direction","a step in the right direction",3,0.000490757402257484
"all fun and games until someone","all fun and games until someone",3,0.000490757402257484
"all your eggs in one basket","all your eggs in one basket",3,0.000490757402257484
"am i the only one that","am i the only one that",3,0.000490757402257484
"and cant wait to see you","and cant wait to see you",3,0.000490757402257484
"and cook for a further minutes","and cook for a further minutes",3,0.000490757402257484
"and i have to say i","and i have to say i",3,0.000490757402257484
"and this is crazy but heres","and this is crazy but heres",3,0.000490757402257484
"anyone with information is asked to","anyone with information is asked to",3,0.000490757402257484
"are just a few of the","are just a few of the",3,0.000490757402257484
"at least once in their life","at least once in their life",3,0.000490757402257484
"at pm april in the block","at pm april in the block",3,0.000490757402257484
"at the beginning of the season","at the beginning of the season",3,0.000490757402257484
"at the end of the month","at the end of the month",3,0.000490757402257484
"at the end of this month","at the end of this month",3,0.000490757402257484
"authority of new york and new","authority of new york and new",3,0.000490757402257484
"be on the receiving end of","be on the receiving end of",3,0.000490757402257484
"be the change you want to","be the change you want to",3,0.000490757402257484
"be the first to admit that","be the first to admit that",3,0.000490757402257484
"been a long time since i","been a long time since i",3,0.000490757402257484
"but at the same time i","but at the same time i",3,0.000490757402257484
"by the end of the year","by the end of the year",3,0.000490757402257484
"by the renewing of your mind","by the renewing of your mind",3,0.000490757402257484
"by the time i got to","by the time i got to",3,0.000490757402257484
"can you please followmecody for it","can you please followmecody for it",3,0.000490757402257484
"cant remember the last time i","cant remember the last time i",3,0.000490757402257484
"cant think of a better way","cant think of a better way",3,0.000490757402257484
"cant wait to see you at","cant wait to see you at",3,0.000490757402257484
"chairman of the joint chiefs of","chairman of the joint chiefs of",3,0.000490757402257484
"change you want to see in","change you want to see in",3,0.000490757402257484
"day of i am thankful for","day of i am thankful for",3,0.000490757402257484
"did not respond to requests for","did not respond to requests for",3,0.000490757402257484
"do the best day of all","do the best day of all",3,0.000490757402257484
"do you know who i am","do you know who i am",3,0.000490757402257484
"do you want to be a","do you want to be a",3,0.000490757402257484
"dont even get me started on","dont even get me started on",3,0.000490757402257484
"dont know what i would do","dont know what i would do",3,0.000490757402257484
"dont want to go to school","dont want to go to school",3,0.000490757402257484
"doubt that a small group of","doubt that a small group of",3,0.000490757402257484
"escaping from demon monkeys in temple","escaping from demon monkeys in temple",3,0.000490757402257484
"event is free and open to","event is free and open to",3,0.000490757402257484
"excited to be a part of","excited to be a part of",3,0.000490757402257484
"failed ive just found ways that","failed ive just found ways that",3,0.000490757402257484
"fell on the new york stock","fell on the new york stock",3,0.000490757402257484
"finished a mi run with a","finished a mi run with a",3,0.000490757402257484
"follow me i would do the","follow me i would do the",3,0.000490757402257484
"follow me it would make my","follow me it would make my",3,0.000490757402257484
"follow me would mean so much","follow me would mean so much",3,0.000490757402257484
"followmecody for it would make her","followmecody for it would make her",3,0.000490757402257484
"for it would make her day","for it would make her day",3,0.000490757402257484
"for the first time in its","for the first time in its",3,0.000490757402257484
"for the first time in the","for the first time in the",3,0.000490757402257484
"for the first time in years","for the first time in years",3,0.000490757402257484
"for the follow looking forward to","for the follow looking forward to",3,0.000490757402257484
"for the rest of the week","for the rest of the week",3,0.000490757402257484
"for those of you who are","for those of you who are",3,0.000490757402257484
"from demon monkeys in temple run","from demon monkeys in temple run",3,0.000490757402257484
"game comment in the android market","game comment in the android market",3,0.000490757402257484
"giants fannie mae and freddie mac","giants fannie mae and freddie mac",3,0.000490757402257484
"got points while escaping from demon","got points while escaping from demon",3,0.000490757402257484
"happy mothers day to all those","happy mothers day to all those",3,0.000490757402257484
"has nothing to do with the","has nothing to do with the",3,0.000490757402257484
"has to be one of the","has to be one of the",3,0.000490757402257484
"have not failed ive just found","have not failed ive just found",3,0.000490757402257484
"have to find a way to","have to find a way to",3,0.000490757402257484
"hope you all had a wonderful","hope you all had a wonderful",3,0.000490757402257484
"hope you had a good time","hope you had a good time",3,0.000490757402257484
"hope you have a good day","hope you have a good day",3,0.000490757402257484
"hope you have a great day","hope you have a great day",3,0.000490757402257484
"i am going to have to","i am going to have to",3,0.000490757402257484
"i am so glad i did","i am so glad i did",3,0.000490757402257484
"i cant help but think that","i cant help but think that",3,0.000490757402257484
"i cant wait to get my","i cant wait to get my",3,0.000490757402257484
"i cant wait to read it","i cant wait to read it",3,0.000490757402257484
"i cant wait to see the","i cant wait to see the",3,0.000490757402257484
"i cant wait to see them","i cant wait to see them",3,0.000490757402257484
"i cant wait to see you","i cant wait to see you",3,0.000490757402257484
"i decided that i wanted to","i decided that i wanted to",3,0.000490757402257484
"i dont know what i would","i dont know what i would",3,0.000490757402257484
"i fell in love with the","i fell in love with the",3,0.000490757402257484
"i got points while escaping from","i got points while escaping from",3,0.000490757402257484
"i had a dream last night","i had a dream last night",3,0.000490757402257484
"i have been so busy with","i have been so busy with",3,0.000490757402257484
"i have never been able to","i have never been able to",3,0.000490757402257484
"i have not failed ive just","i have not failed ive just",3,0.000490757402257484
"i have to go to the","i have to go to the",3,0.000490757402257484
"i have to say i was","i have to say i was",3,0.000490757402257484
"i havent been on twitter in","i havent been on twitter in",3,0.000490757402257484
"i havent talked to you in","i havent talked to you in",3,0.000490757402257484
"i hope you have a great","i hope you have a great",3,0.000490757402257484
"i knew this was going to","i knew this was going to",3,0.000490757402257484
"i like the way you think","i like the way you think",3,0.000490757402257484
"i need to get back to","i need to get back to",3,0.000490757402257484
"i would do the best day","i would do the best day",3,0.000490757402257484
"i would love to see the","i would love to see the",3,0.000490757402257484
"i would love to see you","i would love to see you",3,0.000490757402257484
"if you would like to be","if you would like to be",3,0.000490757402257484
"ill be the first to admit","ill be the first to admit",3,0.000490757402257484
"ill have to check it out","ill have to check it out",3,0.000490757402257484
"in front of the other and","in front of the other and",3,0.000490757402257484
"in my neck of the woods","in my neck of the woods",3,0.000490757402257484
"in the blink of an eye","in the blink of an eye",3,0.000490757402257484
"in the bottom of the first","in the bottom of the first",3,0.000490757402257484
"in the bottom of the seventh","in the bottom of the seventh",3,0.000490757402257484
"in the first three months of","in the first three months of",3,0.000490757402257484
"in the not too distant future","in the not too distant future",3,0.000490757402257484
"in the wee hours of the","in the wee hours of the",3,0.000490757402257484
"incorporated in item b above pp","incorporated in item b above pp",3,0.000490757402257484
"is going to be a good","is going to be a good",3,0.000490757402257484
"is no such thing as a","is no such thing as a",3,0.000490757402257484
"is not to be confused with","is not to be confused with",3,0.000490757402257484
"is the right thing to do","is the right thing to do",3,0.000490757402257484
"it had nothing to do with","it had nothing to do with",3,0.000490757402257484
"it has been a long time","it has been a long time",3,0.000490757402257484
"it has nothing to do with","it has nothing to do with",3,0.000490757402257484
"it has to do with the","it has to do with the",3,0.000490757402257484
"it is going to be a","it is going to be a",3,0.000490757402257484
"it is one of the most","it is one of the most",3,0.000490757402257484
"it was a lot of fun","it was a lot of fun",3,0.000490757402257484
"it was great to meet you","it was great to meet you",3,0.000490757402257484
"it was just a matter of","it was just a matter of",3,0.000490757402257484
"it was one of the first","it was one of the first",3,0.000490757402257484
"its all fun and games until","its all fun and games until",3,0.000490757402257484
"its been a long time since","its been a long time since",3,0.000490757402257484
"ive been doing a lot of","ive been doing a lot of",3,0.000490757402257484
