"","word","freq","prob"
"once heard given to a young","once heard given to a young",2,0.000327171601504989
"one day you will notice me","one day you will notice me",2,0.000327171601504989
"one of my all time favorites","one of my all time favorites",2,0.000327171601504989
"one of my favourite stamps from","one of my favourite stamps from",2,0.000327171601504989
"one of only a handful of","one of only a handful of",2,0.000327171601504989
"one of the best books ive","one of the best books ive",2,0.000327171601504989
"one of the first places i","one of the first places i",2,0.000327171601504989
"one of the first things that","one of the first things that",2,0.000327171601504989
"one of the great things about","one of the great things about",2,0.000327171601504989
"one of the highlights of the","one of the highlights of the",2,0.000327171601504989
"one of the most important things","one of the most important things",2,0.000327171601504989
"one of the nations largest pharmacy","one of the nations largest pharmacy",2,0.000327171601504989
"one of the worst teams in","one of the worst teams in",2,0.000327171601504989
"one of those days where i","one of those days where i",2,0.000327171601504989
"one that fell on the new","one that fell on the new",2,0.000327171601504989
"one thing to keep in mind","one thing to keep in mind",2,0.000327171601504989
"one who can lay a firm","one who can lay a firm",2,0.000327171601504989
"only thing that ever has margaret","only thing that ever has margaret",2,0.000327171601504989
"open daily from am to pm","open daily from am to pm",2,0.000327171601504989
"opportunity to go through all the","opportunity to go through all the",2,0.000327171601504989
"or at least thats what i","or at least thats what i",2,0.000327171601504989
"or cents a share in the","or cents a share in the",2,0.000327171601504989
"or cents per share in the","or cents per share in the",2,0.000327171601504989
"or if you would like to","or if you would like to",2,0.000327171601504989
"or no if you need more","or no if you need more",2,0.000327171601504989
"other regions of the country but","other regions of the country but",2,0.000327171601504989
"others to dream more learn more","others to dream more learn more",2,0.000327171601504989
"our mission in afghanistan while delivering","our mission in afghanistan while delivering",2,0.000327171601504989
"our troops in harms way has","our troops in harms way has",2,0.000327171601504989
"out at the end of the","out at the end of the",2,0.000327171601504989
"out in a week or two","out in a week or two",2,0.000327171601504989
"out of tunisia the fbi instead","out of tunisia the fbi instead",2,0.000327171601504989
"out of your busy day to","out of your busy day to",2,0.000327171601504989
"out there a happy mothers day","out there a happy mothers day",2,0.000327171601504989
"outs in the bottom of the","outs in the bottom of the",2,0.000327171601504989
"over and over and over again","over and over and over again",2,0.000327171601504989
"over the course of the film","over the course of the film",2,0.000327171601504989
"over the number of our troops","over the number of our troops",2,0.000327171601504989
"over the past two years with","over the past two years with",2,0.000327171601504989
"own work he also provided drawings","own work he also provided drawings",2,0.000327171601504989
"park and the museum of science","park and the museum of science",2,0.000327171601504989
"part of the reason for the","part of the reason for the",2,0.000327171601504989
"part of this future if they","part of this future if they",2,0.000327171601504989
"past few years i have been","past few years i have been",2,0.000327171601504989
"path to fulfill our mission in","path to fulfill our mission in",2,0.000327171601504989
"pay their fair share of taxes","pay their fair share of taxes",2,0.000327171601504989
"people find it so hard to","people find it so hard to",2,0.000327171601504989
"percent of success is showing up","percent of success is showing up",2,0.000327171601504989
"percent to million ballys atlantic city","percent to million ballys atlantic city",2,0.000327171601504989
"person always do what you are","person always do what you are",2,0.000327171601504989
"personalities but because of different visions","personalities but because of different visions",2,0.000327171601504989
"personality with my attitude my personality","personality with my attitude my personality",2,0.000327171601504989
"phone owners for  hours nyc","phone owners for  hours nyc",2,0.000327171601504989
"pig party which came out in","pig party which came out in",2,0.000327171601504989
"pin the shit out of my","pin the shit out of my",2,0.000327171601504989
"play a major role in the","play a major role in the",2,0.000327171601504989
"please follow and let her know","please follow and let her know",2,0.000327171601504989
"point im trying to make is","point im trying to make is",2,0.000327171601504989
"points in the first half and","points in the first half and",2,0.000327171601504989
"pole and so can you a","pole and so can you a",2,0.000327171601504989
"police responded to a report of","police responded to a report of",2,0.000327171601504989
"portland general manager and head coach","portland general manager and head coach",2,0.000327171601504989
"possession of a weapon for an","possession of a weapon for an",2,0.000327171601504989
"prepared to head back to tigard","prepared to head back to tigard",2,0.000327171601504989
"pretty much the rest of the","pretty much the rest of the",2,0.000327171601504989
"princess and adaptations of eta hoffmans","princess and adaptations of eta hoffmans",2,0.000327171601504989
"prison without the possibility of parole","prison without the possibility of parole",2,0.000327171601504989
"profile and now all of my","profile and now all of my",2,0.000327171601504989
"program the university of chicago the","program the university of chicago the",2,0.000327171601504989
"program weekend conference the university of","program weekend conference the university of",2,0.000327171601504989
"project about noses and he endorsed","project about noses and he endorsed",2,0.000327171601504989
"prove what is that good and","prove what is that good and",2,0.000327171601504989
"provide texttopay monthly rent via text","provide texttopay monthly rent via text",2,0.000327171601504989
"public library chicago illinois incorporated in","public library chicago illinois incorporated in",2,0.000327171601504989
"pulled into the threads of the","pulled into the threads of the",2,0.000327171601504989
"put all your eggs in one","put all your eggs in one",2,0.000327171601504989
"puts a smile on my face","puts a smile on my face",2,0.000327171601504989
"questioned him about his religious beliefs","questioned him about his religious beliefs",2,0.000327171601504989
"r e t w e e","r e t w e e",2,0.000327171601504989
"racks on racks on racks maybachs","racks on racks on racks maybachs",2,0.000327171601504989
"raise taxes on the wealthiest americans","raise taxes on the wealthiest americans",2,0.000327171601504989
"rate minimum critical damage attacks up","rate minimum critical damage attacks up",2,0.000327171601504989
"reach the second round of the","reach the second round of the",2,0.000327171601504989
"read on to find out who","read on to find out who",2,0.000327171601504989
"ready to hit the ground running","ready to hit the ground running",2,0.000327171601504989
"real measure of your wealth is","real measure of your wealth is",2,0.000327171601504989
"really dont know what to do","really dont know what to do",2,0.000327171601504989
"reason people find it so hard","reason people find it so hard",2,0.000327171601504989
"received percent of the vote to","received percent of the vote to",2,0.000327171601504989
"recent book that he wrote and","recent book that he wrote and",2,0.000327171601504989
"recent months he had said he","recent months he had said he",2,0.000327171601504989
"recently got the chance to talk","recently got the chance to talk",2,0.000327171601504989
"reconsider its scope of financial commitment","reconsider its scope of financial commitment",2,0.000327171601504989
"record your familys voicemail intro is","record your familys voicemail intro is",2,0.000327171601504989
"recourse but to reconsider its scope","recourse but to reconsider its scope",2,0.000327171601504989
"rejected beijings criticism of the us","rejected beijings criticism of the us",2,0.000327171601504989
"religious beliefs family members said tarhuni","religious beliefs family members said tarhuni",2,0.000327171601504989
"remarks that rejected beijings criticism of","remarks that rejected beijings criticism of",2,0.000327171601504989
"remembered that they were but flesh","remembered that they were but flesh",2,0.000327171601504989
"remembers a womans birthday but never","remembers a womans birthday but never",2,0.000327171601504989
"renounce violence and abide by afghan","renounce violence and abide by afghan",2,0.000327171601504989
"replays appeared to show he was","replays appeared to show he was",2,0.000327171601504989
"resident of the portland area for","resident of the portland area for",2,0.000327171601504989
"resort east troy wisconsin incorporated in","resort east troy wisconsin incorporated in",2,0.000327171601504989
"returned it yards for a touchdown","returned it yards for a touchdown",2,0.000327171601504989
"rhine said the board will likely","rhine said the board will likely",2,0.000327171601504989
"right at the beginning of the","right at the beginning of the",2,0.000327171601504989
"right in the middle of the","right in the middle of the",2,0.000327171601504989
"right now that all ive ever","right now that all ive ever",2,0.000327171601504989
"rose for every one that fell","rose for every one that fell",2,0.000327171601504989
"round of the playoffs with tim","round of the playoffs with tim",2,0.000327171601504989
"rt i would love to see","rt i would love to see",2,0.000327171601504989
"ruleth his spirit than he that","ruleth his spirit than he that",2,0.000327171601504989
"run with a time of with","run with a time of with",2,0.000327171601504989
"runs in twothirds of an inning","runs in twothirds of an inning",2,0.000327171601504989
"sad feelings get pulled into the","sad feelings get pulled into the",2,0.000327171601504989
"sad to hear of the passing","sad to hear of the passing",2,0.000327171601504989
"said he did not know if","said he did not know if",2,0.000327171601504989
"said he did not know whether","said he did not know whether",2,0.000327171601504989
"said he told her he was","said he told her he was",2,0.000327171601504989
"said he was working on a","said he was working on a",2,0.000327171601504989
"said in a statement that the","said in a statement that the",2,0.000327171601504989
"said it was built as a","said it was built as a",2,0.000327171601504989
"said it was important that the","said it was important that the",2,0.000327171601504989
"said tarhuni a naturalized us citizen","said tarhuni a naturalized us citizen",2,0.000327171601504989
"said the board will likely determine","said the board will likely determine",2,0.000327171601504989
"saints defensive end will smith was","saints defensive end will smith was",2,0.000327171601504989
"sat at the kitchen table and","sat at the kitchen table and",2,0.000327171601504989
"saturated mg cholesterol mg sodium fiber","saturated mg cholesterol mg sodium fiber",2,0.000327171601504989
"say i was extremely happy to","say i was extremely happy to",2,0.000327171601504989
"saysomething comes to itunes i will","saysomething comes to itunes i will",2,0.000327171601504989
"school of planning and public policy","school of planning and public policy",2,0.000327171601504989
"sea salt and cracked black pepper","sea salt and cracked black pepper",2,0.000327171601504989
"season with salt and pepper set","season with salt and pepper set",2,0.000327171601504989
"second round of the playoffs with","second round of the playoffs with",2,0.000327171601504989
"seconds damage critical rate minimum critical","seconds damage critical rate minimum critical",2,0.000327171601504989
"secretary of state hillary rodham clinton","secretary of state hillary rodham clinton",2,0.000327171601504989
"see its not selling very well","see its not selling very well",2,0.000327171601504989
"see the past better than it","see the past better than it",2,0.000327171601504989
"see this but please follow me","see this but please follow me",2,0.000327171601504989
"see what you do with them","see what you do with them",2,0.000327171601504989
"see you there have a great","see you there have a great",2,0.000327171601504989
"seems right now that all ive","seems right now that all ive",2,0.000327171601504989
"series jinx and the silk sisters","series jinx and the silk sisters",2,0.000327171601504989
"series little bear george macdonalds the","series little bear george macdonalds the",2,0.000327171601504989
"series the basic program the university","series the basic program the university",2,0.000327171601504989
"set the as down in order","set the as down in order",2,0.000327171601504989
"several interviews this week to try","several interviews this week to try",2,0.000327171601504989
"share of the secondround lead with","share of the secondround lead with",2,0.000327171601504989
"share on the new york stock","share on the new york stock",2,0.000327171601504989
"she is one of the best","she is one of the best",2,0.000327171601504989
"she wanted to watch and she","she wanted to watch and she",2,0.000327171601504989
"shocking to me she said i","shocking to me she said i",2,0.000327171601504989
"shooting percent from the field and","shooting percent from the field and",2,0.000327171601504989
"shot put with a throw of","shot put with a throw of",2,0.000327171601504989
"shoutout to for being swag and","shoutout to for being swag and",2,0.000327171601504989
"since i was a little kid","since i was a little kid",2,0.000327171601504989
"since the beginning of the year","since the beginning of the year",2,0.000327171601504989
"singles a few suggestions to show","singles a few suggestions to show",2,0.000327171601504989
"sister and i are going to","sister and i are going to",2,0.000327171601504989
"sitting in the middle of the","sitting in the middle of the",2,0.000327171601504989
"slow to anger is better than","slow to anger is better than",2,0.000327171601504989
"small group of thoughtful committed people","small group of thoughtful committed people",2,0.000327171601504989
"snow let it snow let it","snow let it snow let it",2,0.000327171601504989
"so can you a childrens story","so can you a childrens story",2,0.000327171601504989
"so exciting adventures of a dabbler","so exciting adventures of a dabbler",2,0.000327171601504989
"so hard to be happy is","so hard to be happy is",2,0.000327171601504989
"so hungry i could eat at","so hungry i could eat at",2,0.000327171601504989
"so it will come as no","so it will come as no",2,0.000327171601504989
"so its pretty easy to get","so its pretty easy to get",2,0.000327171601504989
"so much for the follow if","so much for the follow if",2,0.000327171601504989
"so much fun cant wait to","so much fun cant wait to",2,0.000327171601504989
"so that i could have my","so that i could have my",2,0.000327171601504989
"so that we dont have to","so that we dont have to",2,0.000327171601504989
"so there you have it a","so there you have it a",2,0.000327171601504989
"so what are you waiting for","so what are you waiting for",2,0.000327171601504989
"so what does that mean for","so what does that mean for",2,0.000327171601504989
"so you have plenty of time","so you have plenty of time",2,0.000327171601504989
"solemnly swear that i will support","solemnly swear that i will support",2,0.000327171601504989
"someone gives you strength while loving","someone gives you strength while loving",2,0.000327171601504989
"song saysomething comes to itunes i","song saysomething comes to itunes i",2,0.000327171601504989
"south america where earnings fell percent","south america where earnings fell percent",2,0.000327171601504989
"spent a lot of time in","spent a lot of time in",2,0.000327171601504989
"spent a lot of time on","spent a lot of time on",2,0.000327171601504989
"spent the first five years of","spent the first five years of",2,0.000327171601504989
"spirit than he that taketh a","spirit than he that taketh a",2,0.000327171601504989
"spokesman for house speaker william g","spokesman for house speaker william g",2,0.000327171601504989
"sports authority field at mile high","sports authority field at mile high",2,0.000327171601504989
"spread by fools and accepted by","spread by fools and accepted by",2,0.000327171601504989
"st peters college in jersey city","st peters college in jersey city",2,0.000327171601504989
"standing in line at the grocery","standing in line at the grocery",2,0.000327171601504989
"state department of assessments and taxation","state department of assessments and taxation",2,0.000327171601504989
"state department of fish and game","state department of fish and game",2,0.000327171601504989
"states against all enemies foreign and","states against all enemies foreign and",2,0.000327171601504989
"stephen colberts i am a pole","stephen colberts i am a pole",2,0.000327171601504989
"still havent made up my mind","still havent made up my mind",2,0.000327171601504989
"still in bed in a hooded","still in bed in a hooded",2,0.000327171601504989
"stopped by police and pressed to","stopped by police and pressed to",2,0.000327171601504989
"stores open at least a year","stores open at least a year",2,0.000327171601504989
"story calculated to offend the master","story calculated to offend the master",2,0.000327171601504989
"story in europe where gm lost","story in europe where gm lost",2,0.000327171601504989
"strength while loving someone deeply gives","strength while loving someone deeply gives",2,0.000327171601504989
"students who were struck by batons","students who were struck by batons",2,0.000327171601504989
"suggestions to show them you love","suggestions to show them you love",2,0.000327171601504989
"summers in the air baby heavens","summers in the air baby heavens",2,0.000327171601504989
"sun is shining where you are","sun is shining where you are",2,0.000327171601504989
"sunday night shakedown on the buzz","sunday night shakedown on the buzz",2,0.000327171601504989
"support and defend the constitution of","support and defend the constitution of",2,0.000327171601504989
"surgery to repair a torn ligament","surgery to repair a torn ligament",2,0.000327171601504989
"susan g komen for the cure","susan g komen for the cure",2,0.000327171601504989
"swag and bein my cuzin follow","swag and bein my cuzin follow",2,0.000327171601504989
"swear that i will support and","swear that i will support and",2,0.000327171601504989
"sweatshirt under all the covers all","sweatshirt under all the covers all",2,0.000327171601504989
"t w e e t if","t w e e t if",2,0.000327171601504989
"take a bit of getting used","take a bit of getting used",2,0.000327171601504989
"tarhuni a naturalized us citizen and","tarhuni a naturalized us citizen and",2,0.000327171601504989
"taught me to shoot for my","taught me to shoot for my",2,0.000327171601504989
"teams international but as he prepared","teams international but as he prepared",2,0.000327171601504989
"tell me and i give you","tell me and i give you",2,0.000327171601504989
"tell you how much i love","tell you how much i love",2,0.000327171601504989
"texas family law tip of the","texas family law tip of the",2,0.000327171601504989
"texttopay monthly rent via text message","texttopay monthly rent via text message",2,0.000327171601504989
"th anniversary of the sept attacks","th anniversary of the sept attacks",2,0.000327171601504989
"th looking for cell phone owners","th looking for cell phone owners",2,0.000327171601504989
"than he that taketh a city","than he that taketh a city",2,0.000327171601504989
"than the mighty and he that","than the mighty and he that",2,0.000327171601504989
"thank you all so much for","thank you all so much for",2,0.000327171601504989
"thank you for all of your","thank you for all of your",2,0.000327171601504989
"thank you for allowing me to","thank you for allowing me to",2,0.000327171601504989
"thank you for being such a","thank you for being such a",2,0.000327171601504989
"thank you for letting me vent","thank you for letting me vent",2,0.000327171601504989
"thank you for taking the time","thank you for taking the time",2,0.000327171601504989
"thank you for the bday wishes","thank you for the bday wishes",2,0.000327171601504989
"thank you for the follow as","thank you for the follow as",2,0.000327171601504989
"thank you for the kind words","thank you for the kind words",2,0.000327171601504989
"thank you have a great day","thank you have a great day",2,0.000327171601504989
"thank you so much to everyone","thank you so much to everyone",2,0.000327171601504989
"thank you thank you thank you","thank you thank you thank you",2,0.000327171601504989
"thank you to all who came","thank you to all who came",2,0.000327171601504989
"thanks for following me on twitter","thanks for following me on twitter",2,0.000327171601504989
"thanks for following the hilltop on","thanks for following the hilltop on",2,0.000327171601504989
"thanks for helping spread the word","thanks for helping spread the word",2,0.000327171601504989
"thanks for the follow as well","thanks for the follow as well",2,0.000327171601504989
"thanks for the follow i hope","thanks for the follow i hope",2,0.000327171601504989
"thanks for the follow i look","thanks for the follow i look",2,0.000327171601504989
"thanks for the follow love your","thanks for the follow love your",2,0.000327171601504989
"thanks for the rts and mentions","thanks for the rts and mentions",2,0.000327171601504989
"thanks so much for letting me","thanks so much for letting me",2,0.000327171601504989
"thanks to all who came out","thanks to all who came out",2,0.000327171601504989
"that all ive ever done in","that all ive ever done in",2,0.000327171601504989
"that awkward moment when you dont","that awkward moment when you dont",2,0.000327171601504989
"that awkward moment when you realize","that awkward moment when you realize",2,0.000327171601504989
"that can be used as a","that can be used as a",2,0.000327171601504989
"that for more than a year","that for more than a year",2,0.000327171601504989
"that good and acceptable and perfect","that good and acceptable and perfect",2,0.000327171601504989
"that he wrote and illustrated was","that he wrote and illustrated was",2,0.000327171601504989
"that i can take care of","that i can take care of",2,0.000327171601504989
"that i dont want to be","that i dont want to be",2,0.000327171601504989
"that i had to do something","that i had to do something",2,0.000327171601504989
"that i might be able to","that i might be able to",2,0.000327171601504989
"that i need to be more","that i need to be more",2,0.000327171601504989
"that i once heard given to","that i once heard given to",2,0.000327171601504989
"that i will support and defend","that i will support and defend",2,0.000327171601504989
"that im going to have to","that im going to have to",2,0.000327171601504989
"that in the next couple of","that in the next couple of",2,0.000327171601504989
"that is slow to anger is","that is slow to anger is",2,0.000327171601504989
"that is wrong with america is","that is wrong with america is",2,0.000327171601504989
"that its index of manufacturing activity","that its index of manufacturing activity",2,0.000327171601504989
"that kangarros cant jump backwards australias","that kangarros cant jump backwards australias",2,0.000327171601504989
"that rejected beijings criticism of the","that rejected beijings criticism of the",2,0.000327171601504989
"that ruleth his spirit than he","that ruleth his spirit than he",2,0.000327171601504989
"that there are a lot of","that there are a lot of",2,0.000327171601504989
"that they always see the past","that they always see the past",2,0.000327171601504989
"that they can be a part","that they can be a part",2,0.000327171601504989
"that they were but flesh a","that they were but flesh a",2,0.000327171601504989
"that to me all the time","that to me all the time",2,0.000327171601504989
"thats all im going to say","thats all im going to say",2,0.000327171601504989
"thats why we close our eyes","thats why we close our eyes",2,0.000327171601504989
"the air baby heavens in your","the air baby heavens in your",2,0.000327171601504989
"the anniversary of bin ladens death","the anniversary of bin ladens death",2,0.000327171601504989
"the ark professionals built the titanic","the ark professionals built the titanic",2,0.000327171601504989
"the associated press contributed to this","the associated press contributed to this",2,0.000327171601504989
"the associated press in an interview","the associated press in an interview",2,0.000327171601504989
"the attack on pearl harbor in","the attack on pearl harbor in",2,0.000327171601504989
"the author of the lulu baker","the author of the lulu baker",2,0.000327171601504989
"the basic program the university of","the basic program the university of",2,0.000327171601504989
"the beginning of the end of","the beginning of the end of",2,0.000327171601504989
"the best day of all please","the best day of all please",2,0.000327171601504989
"the best night of my life","the best night of my life",2,0.000327171601504989
"the best seat in the house","the best seat in the house",2,0.000327171601504989
"the best way for them to","the best way for them to",2,0.000327171601504989
"the best way i can describe","the best way i can describe",2,0.000327171601504989
"the best way i have found","the best way i have found",2,0.000327171601504989
